<?xml version="1.0" encoding="utf-8"?>
<xs:schema id="i18N" elementFormDefault="qualified" xmlns="" xmlns:xs="http://www.w3.org/2001/XMLSchema">
  <xs:element name="i18N">
    <xs:complexType>
      <xs:sequence>
        <xs:element name="Languages" minOccurs="1" maxOccurs="1">
          <xs:complexType>
            <xs:sequence>
              <xs:element name="Language" minOccurs="1" maxOccurs="unbounded">
                <xs:complexType>
                  <xs:sequence>
                    <xs:element name="Fonts" minOccurs="1" maxOccurs="1">
                      <xs:complexType>
                        <xs:sequence>
                          <xs:element name="Font" minOccurs="1" maxOccurs="unbounded">
                            <xs:complexType>
                              <xs:sequence>
                              </xs:sequence>
                              <xs:attribute name="Name" type="xs:string" />
                              <xs:attribute name="Description" type="xs:string" />
                            </xs:complexType>
                          </xs:element>
                        </xs:sequence>
                      </xs:complexType>
                    </xs:element>
                    <xs:element name="Messages" minOccurs="0" maxOccurs="1">
                      <xs:complexType>
                        <xs:sequence>
                          <xs:element name="Message" minOccurs="0" maxOccurs="unbounded">
                            <xs:complexType>
                              <xs:sequence>
                              </xs:sequence>
                              <xs:attribute name="Id" type="xs:string" />
                              <xs:attribute name="Msgstring" type="xs:string" />
                              <xs:attribute name="Group" type="xs:string" use="optional" />
                            </xs:complexType>
                          </xs:element>
                        </xs:sequence>
                      </xs:complexType>
                    </xs:element>
                  </xs:sequence>
                  <xs:attribute name="code" type="xs:string" />
                </xs:complexType>
              </xs:element>
            </xs:sequence>
          </xs:complexType>
        </xs:element>
      </xs:sequence>
    </xs:complexType>
  </xs:element>
</xs:schema>